{
  "schemaVersion": "research_prospect_inventory_v1",
  "inventoryId": "prospects-tnm-manual-20260806074419",
  "runId": "tnm-manual-20260806074419",
  "createdAt": "2026-08-06T07:55:38.289Z",
  "scope": "3 named published records selected for deep, exact-baseline enrichment.",
  "prospects": [
    {
      "id": "prospect-gdms-canada-defence-posture",
      "name": "General Dynamics Mission Systems–Canada land C4ISR and secure communications",
      "proposedEntityType": "organization",
      "proposedOrganizationKind": "company",
      "canonicalUrl": "https://gdmissionsystems.ca/",
      "discoverySourceUrl": "https://ised-isde.canada.ca/site/industrial-technological-benefits/en/projects-and-obligations/report-contractor-progress/breakdown-current-obligations-contractor",
      "discoveryLane": "government_program",
      "countryCode": "CA",
      "fitSummary": "Named published target with a material evidence-backed enrichment path: General Dynamics Mission Systems–Canada is a direct defence-system integrator for Canadian and allied tactical communications, secure networks, and C4ISR, including the Canadian Army's LCSS and a current federal Mercury Global secure-communications obligation.",
      "disposition": "selected",
      "rejectionReason": null,
      "recoveryAttempts": [
        {
          "lane": "government_program",
          "url": "https://ised-isde.canada.ca/site/industrial-technological-benefits/en/projects-and-obligations/report-contractor-progress/breakdown-current-obligations-contractor",
          "outcome": "Selected after exact-baseline comparison showed a non-duplicative decision-useful delta."
        }
      ]
    },
    {
      "id": "prospect-magellan-aerospace-defence-posture",
      "name": "Magellan Aerospace Canadian defence manufacturing",
      "proposedEntityType": "organization",
      "proposedOrganizationKind": "company",
      "canonicalUrl": "https://magellan.aero/",
      "discoverySourceUrl": "https://www.canada.ca/en/prairies-economic-development/news/2026/04/government-of-canada-investing-in-winnipeg-industry-to-strengthen-canadas-defence-capacity.html",
      "discoveryLane": "procurement",
      "countryCode": "CA",
      "fitSummary": "Named published target with a material evidence-backed enrichment path: Magellan Aerospace is a direct Canadian defence and space manufacturer with military-aircraft, ammunition, and propulsion work, reinforced by a 2026 federal investment in Winnipeg machining capacity and a recorded DND M72 purchase contract.",
      "disposition": "selected",
      "rejectionReason": null,
      "recoveryAttempts": [
        {
          "lane": "procurement",
          "url": "https://www.canada.ca/en/prairies-economic-development/news/2026/04/government-of-canada-investing-in-winnipeg-industry-to-strengthen-canadas-defence-capacity.html",
          "outcome": "Selected after exact-baseline comparison showed a non-duplicative decision-useful delta."
        }
      ]
    },
    {
      "id": "prospect-pal-aerospace-defence-posture",
      "name": "PAL Aerospace RCAF training, missionization, and sustainment",
      "proposedEntityType": "organization",
      "proposedOrganizationKind": "company",
      "canonicalUrl": "https://palaerospace.com/",
      "discoverySourceUrl": "https://palaerospace.com/ct-142q-citadel-fact-agreement/",
      "discoveryLane": "company_newsroom",
      "countryCode": "CA",
      "fitSummary": "Named published target with a material evidence-backed enrichment path: PAL Aerospace is a direct Canadian aerospace and defence operator, mission-system integrator, trainer, and sustainment provider; its July 2026 CT-142Q announcement describes an agreement toward an approximately CAD 750 million FAcT role, with contract finalization still pending in that release.",
      "disposition": "selected",
      "rejectionReason": null,
      "recoveryAttempts": [
        {
          "lane": "company_newsroom",
          "url": "https://palaerospace.com/ct-142q-citadel-fact-agreement/",
          "outcome": "Selected after exact-baseline comparison showed a non-duplicative decision-useful delta."
        }
      ]
    }
  ]
}
